{
  "schema_version": "burr.rulepack.v1",
  "id": "printed_plate",
  "version": "0.2.0",
  "artifact_type": "printed_plate",
  "rules": [
    {
      "id": "m3_mount_hole_edge_distance",
      "kind": "hole_edge_distance",
      "applies_to": {
        "kind": "clearance_hole",
        "fastener": "M3",
        "intent_any": ["mechanical_interface"],
        "role_any": ["mount", "loaded_mount", "alignment"]
      },
      "min_center_to_edge_diameter_multiple": 3.0
    },
    {
      "id": "m3_mount_hole_wall_thickness",
      "kind": "minimum_wall_thickness",
      "applies_to": {
        "kind": "clearance_hole",
        "fastener": "M3",
        "intent_any": ["mechanical_interface"],
        "role_any": ["mount", "loaded_mount", "alignment"]
      },
      "min_wall_thickness_mm": 1.2
    },
    {
      "id": "mechanical_slot_step_presence",
      "kind": "feature_presence",
      "applies_to": {
        "kind": "straight_slot",
        "intent_any": [
          "mechanical_interface"
        ],
        "role_any": [
          "adjustable_mount"
        ]
      },
      "artifact_kind": "step",
      "axis_dot_min": 0.999,
      "width_tolerance_mm": 0.15,
      "endpoint_tolerance_mm": 0.15,
      "side_plane_tolerance_mm": 0.15
    },
    {
      "id": "cosmetic_relief_inventory",
      "kind": "feature_count",
      "applies_to": {
        "kind": "clearance_hole",
        "intent_any": ["cosmetic"],
        "role_any": ["visual_lightening"]
      },
      "min_count": 8,
      "max_count": 80
    },
    {
      "id": "cosmetic_relief_ligament",
      "kind": "feature_pair_spacing",
      "applies_to": {
        "kind_any": ["clearance_hole", "straight_slot", "cutout"],
        "intent_any": ["cosmetic"],
        "role_any": ["visual_lightening", "relief_slot"]
      },
      "min_clearance_mm": 1.2
    }
  ]
}
